{
  "schema_version": 1,
  "manifest_id": "koguard-default-dictionary-v1",
  "normalization_form": "NFKC",
  "sources": [
    {"source_id": "koguard-curated-20260910", "kind": "curated", "name": "Koguard owner-approved variant regression", "reference": null, "revision": "2026-09-10", "license": "MIT", "license_status": "approved", "redistribution_allowed": true},
    {
      "source_id": "koguard-curated-v1",
      "kind": "curated",
      "name": "Koguard manually curated defaults",
      "reference": null,
      "revision": "2026-08-18",
      "license": "MIT",
      "license_status": "approved",
      "redistribution_allowed": true
    },
    {
      "source_id": "korcen-eecd9763",
      "kind": "licensed",
      "name": "Tanat05/korcen explicit literal selection",
      "reference": "https://github.com/Tanat05/korcen",
      "revision": "eecd9763dbdccce3dc96ddb578ef0b6396058fa9",
      "license": "MIT",
      "license_status": "approved",
      "redistribution_allowed": true
    },
    {
      "source_id": "curse-detection-data-ff241621",
      "kind": "licensed",
      "name": "2runo/Curse-detection-data PF-005 independent consensus",
      "reference": "https://github.com/2runo/Curse-detection-data",
      "revision": "ff241621e103b6f220d30de324d0d07987887308",
      "license": "MIT",
      "license_status": "approved",
      "redistribution_allowed": true
    }
  ],
  "candidates": [
    {"candidate_id": "core.literal.curated.036", "surface": "븅신", "normalized_surface": "븅신", "canonical": "븅신", "normalized_canonical": "븅신", "representation": "literal", "matcher": "exact", "target_layer": "core", "classification": "positive", "status": "packaged", "source_id": "koguard-curated-20260910", "evaluation_refs": ["tests/test_mask.py", "docs/testing/mask-api.tdd.md"], "review": {"status": "approved", "decision_reference": "docs/dictionary-data-changelog.md", "notes": "Owner authorized the explicitly proposed missing variant on 2026-09-10; local regressions only, no independent corpus claim."}, "notes": "Directly curated variant; no external dataset copied."},
    {"candidate_id":"core.literal.curated.001","surface":"병신","normalized_surface":"병신","canonical":"병신","normalized_canonical":"병신","representation":"literal","matcher":"exact","target_layer":"core","classification":"positive","status":"packaged","source_id":"koguard-curated-v1","evaluation_refs":["tests/corpus/exact_cases.json","docs/accuracy-baseline.md"],"review":{"status":"approved","decision_reference":"src/koguard/data/NOTICE.md","notes":"Koguard default lexical core."},"notes":"Context-independent exact substring."},
    {"candidate_id":"core.literal.curated.002","surface":"시발","normalized_surface":"시발","canonical":"시발","normalized_canonical":"시발","representation":"literal","matcher":"exact","target_layer":"core","classification":"positive","status":"packaged","source_id":"koguard-curated-v1","evaluation_refs":["tests/corpus/exact_cases.json","docs/accuracy-baseline.md"],"review":{"status":"approved","decision_reference":"src/koguard/data/NOTICE.md","notes":"Koguard default lexical core."},"notes":"Context-independent exact substring."},
    {"candidate_id":"core.literal.curated.003","surface":"씨발","normalized_surface":"씨발","canonical":"씨발","normalized_canonical":"씨발","representation":"literal","matcher":"exact","target_layer":"core","classification":"positive","status":"packaged","source_id":"koguard-curated-v1","evaluation_refs":["tests/corpus/exact_cases.json","docs/accuracy-baseline.md"],"review":{"status":"approved","decision_reference":"src/koguard/data/NOTICE.md","notes":"Koguard default lexical core."},"notes":"Context-independent exact substring."},
    {"candidate_id":"core.literal.curated.004","surface":"개새끼","normalized_surface":"개새끼","canonical":"개새끼","normalized_canonical":"개새끼","representation":"literal","matcher":"exact","target_layer":"core","classification":"positive","status":"packaged","source_id":"koguard-curated-v1","evaluation_refs":["tests/corpus/exact_cases.json","docs/accuracy-baseline.md"],"review":{"status":"approved","decision_reference":"src/koguard/data/NOTICE.md","notes":"Koguard default lexical core."},"notes":"Context-independent exact substring."},
    {"candidate_id":"core.literal.curated.005","surface":"개새","normalized_surface":"개새","canonical":"개새","normalized_canonical":"개새","representation":"literal","matcher":"exact","target_layer":"core","classification":"positive","status":"packaged","source_id":"koguard-curated-v1","evaluation_refs":["tests/test_dictionary.py","docs/accuracy-baseline.md"],"review":{"status":"approved","decision_reference":"src/koguard/data/NOTICE.md","notes":"Koguard default lexical core."},"notes":"Context-independent exact substring."},
    {"candidate_id":"core.literal.curated.006","surface":"좆","normalized_surface":"좆","canonical":"좆","normalized_canonical":"좆","representation":"literal","matcher":"exact","target_layer":"core","classification":"positive","status":"packaged","source_id":"koguard-curated-v1","evaluation_refs":["tests/corpus/exact_cases.json","tests/corpus/alias_cases.json"],"review":{"status":"approved","decision_reference":"src/koguard/data/NOTICE.md","notes":"Koguard default lexical core."},"notes":"Context-independent exact substring."},
    {"candidate_id":"core.literal.curated.007","surface":"좆같다","normalized_surface":"좆같다","canonical":"좆같다","normalized_canonical":"좆같다","representation":"literal","matcher":"exact","target_layer":"core","classification":"positive","status":"packaged","source_id":"koguard-curated-v1","evaluation_refs":["tests/corpus/exact_cases.json","tests/corpus/alias_cases.json"],"review":{"status":"approved","decision_reference":"src/koguard/data/NOTICE.md","notes":"Koguard default lexical core."},"notes":"Context-independent exact substring."},
    {"candidate_id":"core.literal.curated.008","surface":"존나","normalized_surface":"존나","canonical":"존나","normalized_canonical":"존나","representation":"literal","matcher":"exact","target_layer":"core","classification":"positive","status":"packaged","source_id":"koguard-curated-v1","evaluation_refs":["tests/test_dictionary.py","docs/accuracy-baseline.md"],"review":{"status":"approved","decision_reference":"src/koguard/data/NOTICE.md","notes":"Koguard default lexical core."},"notes":"Context-independent exact substring."},
    {"candidate_id":"core.literal.curated.009","surface":"지랄","normalized_surface":"지랄","canonical":"지랄","normalized_canonical":"지랄","representation":"literal","matcher":"exact","target_layer":"core","classification":"positive","status":"packaged","source_id":"koguard-curated-v1","evaluation_refs":["tests/corpus/exact_cases.json","docs/accuracy-baseline.md"],"review":{"status":"approved","decision_reference":"src/koguard/data/NOTICE.md","notes":"Koguard default lexical core."},"notes":"Context-independent exact substring."},
    {"candidate_id":"core.literal.curated.010","surface":"염병","normalized_surface":"염병","canonical":"염병","normalized_canonical":"염병","representation":"literal","matcher":"exact","target_layer":"core","classification":"positive","status":"packaged","source_id":"koguard-curated-v1","evaluation_refs":["tests/test_dictionary.py","docs/accuracy-baseline.md"],"review":{"status":"approved","decision_reference":"src/koguard/data/NOTICE.md","notes":"Koguard default lexical core."},"notes":"Context-independent exact substring."},
    {"candidate_id":"core.literal.curated.011","surface":"미친놈","normalized_surface":"미친놈","canonical":"미친놈","normalized_canonical":"미친놈","representation":"literal","matcher":"exact","target_layer":"core","classification":"positive","status":"packaged","source_id":"koguard-curated-v1","evaluation_refs":["tests/test_dictionary.py","docs/accuracy-baseline.md"],"review":{"status":"approved","decision_reference":"src/koguard/data/NOTICE.md","notes":"Koguard default lexical core."},"notes":"Context-independent exact substring."},
    {"candidate_id":"core.literal.curated.012","surface":"미친년","normalized_surface":"미친년","canonical":"미친년","normalized_canonical":"미친년","representation":"literal","matcher":"exact","target_layer":"core","classification":"positive","status":"packaged","source_id":"koguard-curated-v1","evaluation_refs":["tests/test_dictionary.py","docs/accuracy-baseline.md"],"review":{"status":"approved","decision_reference":"src/koguard/data/NOTICE.md","notes":"Koguard default lexical core."},"notes":"Context-independent exact substring."},
    {"candidate_id":"core.literal.curated.013","surface":"미친새끼","normalized_surface":"미친새끼","canonical":"미친새끼","normalized_canonical":"미친새끼","representation":"literal","matcher":"exact","target_layer":"core","classification":"positive","status":"packaged","source_id":"koguard-curated-v1","evaluation_refs":["tests/test_dictionary.py","docs/accuracy-baseline.md"],"review":{"status":"approved","decision_reference":"src/koguard/data/NOTICE.md","notes":"Koguard default lexical core."},"notes":"Context-independent exact substring."},
    {"candidate_id":"core.literal.curated.014","surface":"개년","normalized_surface":"개년","canonical":"개년","normalized_canonical":"개년","representation":"literal","matcher":"exact","target_layer":"core","classification":"positive","status":"packaged","source_id":"koguard-curated-v1","evaluation_refs":["tests/test_dictionary.py","docs/accuracy-baseline.md"],"review":{"status":"approved","decision_reference":"src/koguard/data/NOTICE.md","notes":"Koguard default lexical core."},"notes":"Context-independent exact substring."},